report,justification_de_url,justification_en_url,TA
Ixekizumab (Plaque-Psoriasis),https://www.g-ba.de/downloads/40-268-4526/2017-08-17_AM-RL-XII_Ixekizumab_D-275_TrG.pdf,,Hauterkrankungen
Ixekizumab (neues Anwendungsgebiet: Psoriasis-Arthritis),https://www.g-ba.de/downloads/40-268-5189/2018-08-16_AM-RL-XII_Ixekizumab_nAWG_D-343_TrG-15-10-2018.pdf,,Krankheiten des Muskel-Skelett-Systems
Lanadelumab (Hereditäres Angioödem),https://www.g-ba.de/downloads/40-268-5909/2019-08-01_AM-RL-XII_Lanadelumab_D-420_TrG.pdf,https://www.g-ba.de/downloads/40-1465-5909/2019-08-01_AM-RL-XII_Lanadelumab_D-420_TrG_EN.pdf,Sonstiges
"Lanadelumab (Überschreitung 50 Mio. € Grenze: hereditäres Angioödem, Prophylaxe, ≥ 12 Jahre)",https://www.g-ba.de/downloads/40-268-8000/2021-11-04_AM-RL-XII_Lanadelumab_D-681_TrG.pdf,https://www.g-ba.de/downloads/40-1465-8000/2021-11-04_AM-RL_XII_Lanadelumab_D-681_TrG_EN.pdf,Sonstiges
Landiololhydrochlorid,https://www.g-ba.de/downloads/40-268-4685/2017-10-19_35a_Freistellung_Landiololhydrochlorid_F-001w_TrG.pdf,,Herz-Kreislauf-Erkrankungen
"Larotrectinib (Solide Tumore, neurotrophen Tyrosin-Rezeptor-Kinase (NTRK)-Genfusion, histologieunabhängig)",https://www.g-ba.de/downloads/40-268-6479/2020-04-02_AM-RL-XII_Larotrectinib_D-495_TrG.pdf,https://www.g-ba.de/downloads/40-1465-6479/2020-04-02_AM-RL-XII_Larotrectinib_D-495_TrG_EN.pdf,onkologische Erkrankungen
Ledipasvir/Sofosbuvir (Chronische Hepatitis C),https://www.g-ba.de/downloads/40-268-3225/2015-05-21_AM-RL-XII_Ledipasvir-Sofosbuvir_2014-12-01-D-143_TrG.pdf,,Infektionskrankheiten
"Ledipasvir/Sofosbuvir (Neues Anwendungsgebiet: Chronische Hepatitis C, 3 bis <12 Jahre)",https://www.g-ba.de/downloads/40-268-7235/2021-01-21_AM-RL-XII_Ledipasvir-Sofosbuvir_D-563_TrG.pdf,https://www.g-ba.de/downloads/40-1465-7235/2021-01-21_AM-RL-XII_Ledipasvir-Sofosbuvir_D-563_TrG_EN.pdf,Infektionskrankheiten
"Ledipasvir/Sofosbuvir (neues Anwendungsgebiet: Chronische Hepatitis C, 12 bis < 18 Jahre)",https://www.g-ba.de/downloads/40-268-4805/2018-02-15_AM-RL-XII_Ledipasvir-Sofosbuvir-nAWG_D-304_TrG.pdf,,Infektionskrankheiten
Lenvatinib,https://www.g-ba.de/downloads/40-268-3495/2015-12-17_AM-RL-XII_Lenvatinib_2015-07-01-D-164_TrG.pdf,,onkologische Erkrankungen
Lenvatinib (Bewertung nach Aufhebung des Orphan Drug-Status: Schilddrüsenkarzinom),https://www.g-ba.de/downloads/40-268-5934/2019-08-15_AM-RL-XII_Lenvatinib_D-428_TrG.pdf,https://www.g-ba.de/downloads/40-1465-5934/2019-08-15_AM-RL-XII_Lenvatinib_D-428_TrG_EN.pdf,onkologische Erkrankungen
Lenvatinib (Neubewertung nach Fristablauf: Nierenzellkarzinom),https://www.g-ba.de/downloads/40-268-7653/2021-07-01_AM-RL-XII_Lenvatinib_D-620_TrG.pdf,https://www.g-ba.de/downloads/40-1465-7653/2021-07-01_AM-RL-XII_Lenvatinib_D-620_TrG_EN.pdf,onkologische Erkrankungen
"Lenvatinib (Neues Anwendungsgebiet: Endometriumkarzinom, nach Platin-basierter Therapie, Kombination mit Pembrolizumab)",,,onkologische Erkrankungen
"Lenvatinib (Neues Anwendungsgebiet: fortgeschrittenes Nierenzellkarzinom, Erstlinie, Kombination mit Pembrolizumab)",,,onkologische Erkrankungen
Lenvatinib (neues Anwendungsgebiet: Hepatozelluläres Karzinom),https://www.g-ba.de/downloads/40-268-5644/2019-03-22_AM-RL-XII_Lenvatinib-nAWG_D-379_TrG.pdf,,onkologische Erkrankungen
Lenvatinib (neues Anwendungsgebiet: Nierenzellkarzinom),https://www.g-ba.de/downloads/40-268-4251/2017-03-16_AM-RL-XII_Lenvatinib_D-257_TrG.pdf,,onkologische Erkrankungen
Letermovir (Cytomegalievirus-Infektion),https://www.g-ba.de/downloads/40-268-5164/2018-08-02_AM-RL-XII_Letermovir_D-342_TrG.pdf,,Infektionskrankheiten
Levofloxacin/Dexamethason (Infektionen und Entzündungen im Zusammenhang mit Kataraktoperationen),https://www.g-ba.de/downloads/40-268-7676/2021-07-15_AM-RL-XII_Levofloxacin-Dexamethason_D-636_TrG.pdf,https://www.g-ba.de/downloads/40-1465-7676/2021-07-15_AM-RL-XII_Levofloxacin-Dexamethason_D-636_TrG_EN.pdf,Augenerkrankungen
Linaclotid (Reizdarmsyndrom mit Obstipation),https://www.g-ba.de/downloads/40-268-2659/2014-01-23_AM-RL-XII_Linaclotid_TK_TrG.pdf,,Krankheiten des Verdauungssystems
Linagliptin,https://www.g-ba.de/downloads/40-268-5891/2019-07-18_AM-RL-XII_Linagliptin_Veranlassung-erneute-NB_TrG.pdf,,Stoffwechselkrankheiten
Linagliptin (Erneute Nutzenbewertung: Diabetes mellitus Typ 2),https://www.g-ba.de/downloads/40-268-5891/2019-07-18_AM-RL-XII_Linagliptin_Veranlassung-erneute-NB_TrG.pdf,,Stoffwechselkrankheiten
Linagliptin (neues Anwendungsgebiet: Diabetes mellitus Typ 2),https://www.g-ba.de/downloads/40-268-5891/2019-07-18_AM-RL-XII_Linagliptin_Veranlassung-erneute-NB_TrG.pdf,,Stoffwechselkrankheiten
"Lisdexamfetamindimesilat (Aufmerksamkeitsdefizit-Hyperaktivitäts-Störungen,  ≥ 6 bis < 18 Jahre)",https://www.g-ba.de/downloads/40-268-2558/2013-11-14_AM-RL-XII_Lisdexamfetamin_TrG.pdf,,Psychische Erkrankungen
"Lisdexamfetamindimesilat (neues Anwendungsgebiet: Aufmerksamkeitsdefizit-Hyperaktivitäts-Störungen, ≥ 18 Jahre)",https://www.g-ba.de/downloads/40-268-6054/2019-10-17_AM-RL-XII_Lisdexamfetamindimesilat_nAWG_D-452_TrG.pdf,https://www.g-ba.de/downloads/40-1465-6054/2019-10-17_AM-RL-XII_Lisdexamfetamindimesilat_D-452_TrG_EN.pdf,Psychische Erkrankungen
Lixisenatid (Diabetes mellitus Typ 2),https://www.g-ba.de/downloads/40-268-4808/2018-02-15_AM-RL-XII_Lixisenatid_erneute-Nutzenbewertung_TrG.pdf,,Stoffwechselkrankheiten
Lomitapid,https://www.g-ba.de/downloads/40-268-2834/2014-06-05_AM-RL-XII_Lomitapid_2013-12-15-D-093_TrG.pdf,,Stoffwechselkrankheiten
Lomitapid (Neubewertung nach Fristablauf: Hypercholesterinämie),https://www.g-ba.de/downloads/40-268-3455/2015-11-27_AM-RL-XII_Lomitapid_2015-06-15-D-169_TrG.pdf,,Stoffwechselkrankheiten
Lonoctocog alfa (Hämophilie A),https://www.g-ba.de/downloads/40-268-4484/2017-07-20_AM-RL-XII_Lonoctocog-alfa_D-273-TrG.pdf,,Krankheiten des Blutes und der blutbildenden Organe
"Lorlatinib (Neues Anwendungsgebiet: Nicht-kleinzelliges Lungenkarzinom, ALK+, Erstlinie)",,,onkologische Erkrankungen
"Lorlatinib (nicht-kleinzelliges Lungenkarzinom, ALK+, vorbehandelte Patienten)",https://www.g-ba.de/downloads/40-268-6147/2019-11-22_AM-RL-XII_Lorlatinib_D-451_TrG.pdf,https://www.g-ba.de/downloads/40-1465-6147/2019-11-22_AM-RL-XII_Lorlatinib_D-451_TrG_EN.pdf,onkologische Erkrankungen
"Lumacaftor/Ivacaftor (Neubewertung nach Fristablauf: zystische Fibrose, homozygot F508del-Mutation im CFTR-Gen, ≥ 2 bis ≤ 5 Jahre)",https://www.g-ba.de/downloads/40-268-8361/2022-03-18_AM-RL-XII_Lumacaftor-Ivacaftor_D-733_TrG.pdf,https://www.g-ba.de/downloads/40-1465-8361/2022-03-18_AM-Rl-XII_Lumacaftor-Ivacaftor_D-733_TrG_EN.pdf,Stoffwechselkrankheiten
"Lumacaftor/Ivacaftor (neues Anwendungsgebiet: zystische Fibrose, homozygot F508del-Mutation im CFTR-Gen, 2–5 Jahre)",https://www.g-ba.de/downloads/40-268-5938/2019-08-15_AM-RL-XII_Lumacaftor-Ivacaftor_D-432_TrG.pdf,https://www.g-ba.de/downloads/40-1465-5938/2019-08-15_AM-RL-XII_Lumacaftor_Ivacaftor_nAWG_D-432_TrG_EN.pdf,Stoffwechselkrankheiten
"Lumacaftor/Ivacaftor (neues Anwendungsgebiet: zystische Fibrose, homozygot F508del-Mutation im CFTR-Gen, ≥ 6 Jahre)",https://www.g-ba.de/downloads/40-268-5174/2018-08-02_AM-RL-XII_Lumacaftor-Ivacaftor_D-339_TrG.pdf,,Stoffwechselkrankheiten
"Lumacaftor/Ivacaftor (zystische Fibrose, > 12 Jahre, homozygot  F508del-Mutation)",https://www.g-ba.de/downloads/40-268-3799/2016-06-02_AM-RL-XII_Lumacaftor-Ivacaftor_D-204_TrG.pdf,,Stoffwechselkrankheiten
Lumasiran (Hyperoxalurie),https://www.g-ba.de/downloads/40-268-7656/2021-07-01_AM-RL-XII_Lumasiran_D-622_TrG.pdf,https://www.g-ba.de/downloads/40-1465-7656/2021-07-01_AM-RL-XII_Lumasiran_D-622_TrG_EN.pdf,Stoffwechselkrankheiten
Lurasidon (Schizophrenie),https://www.g-ba.de/downloads/40-268-3189/2015-04-16_AM-RL-XII_Lurasidon_2014-11-01-D-142_TrG.pdf,,Psychische Erkrankungen
Luspatercept (Myelodysplastische Syndrome (MDS)),https://www.g-ba.de/downloads/40-268-7239/2021-01-21_AM-RL-XII_Luspatercept_MDS_D-561_TrG.pdf,,Krankheiten des Blutes und der blutbildenden Organe
Luspatercept (β-Thalassämie),https://www.g-ba.de/downloads/40-268-7234/2021-01-21_AM-RL-XII_Luspatercept_D-560_TrG.pdf,https://www.g-ba.de/downloads/40-1465-7234/2021-01-21_AM-RL-XII_Luspatercept_D-560_TrG_EN.pdf,Krankheiten des Blutes und der blutbildenden Organe
Lusutrombopag (Thrombozytopenie bei chronischer Lebererkrankung),https://www.g-ba.de/downloads/40-268-8512/2022-05-19_AM-RL-XII_Lusutrombopag_D-731_TrG.pdf,,Krankheiten des Blutes und der blutbildenden Organe
Lutetium-(177Lu)-Oxodotreotid,https://www.g-ba.de/downloads/40-268-4686/2017-10-19_35a_Freistellung_Lutetium-177Lu-Oxodotreotid_F-003_TrG.pdf,,onkologische Erkrankungen
Macitentan,https://www.g-ba.de/downloads/40-268-2888/2014-07-17_AM-RL-XII_Macitentan_2014-02-01-D-096_TrG.pdf,,Herz-Kreislauf-Erkrankungen
Macitentan (Überschreitung 50 Mio € Grenze: Pulmonal arterielle Hypertonie),https://www.g-ba.de/downloads/40-268-4310/2017-04-06_AM-RL-XII_Macitentan_D-260_TrG.pdf,,Herz-Kreislauf-Erkrankungen
Melatonin,https://www.g-ba.de/downloads/40-268-5853/2019-07-04_AM-RL-XII_Melatonin_D-423_TrG.pdf,https://www.g-ba.de/downloads/40-1465-5853/2019-07-04_AM-RL-XII_Melatonin_D-423_TrG_EN.pdf,Krankheiten des Nervensystems
Mepolizumab (Asthma bronchiale),https://www.g-ba.de/downloads/40-268-5461/2018-12-06_AM-RL-XII_Mepolizumab_D-211_TrG.pdf,,Krankheiten des Atmungssystems
Mepolizumab (Neues Anwendungsgebiet: Chronische Rhinosinusitis mit Nasenpolypen),https://www.g-ba.de/downloads/40-268-8516/2022-05-19_AM-RL-XII_Mepolizumab_D-746_TrG.pdf,,Krankheiten des Atmungssystems
Mepolizumab (Neues Anwendungsgebiet: Hypereosinophiles Syndrom),https://www.g-ba.de/downloads/40-268-8517/2022-05-19_AM-RL-XII_Mepolizumab_D-748_TrG.pdf,,Krankheiten des Blutes und der blutbildenden Organe
Mepolizumab (Neues Anwendungsgebiet: eosinophile Granulomatose mit Polyangiitis),https://www.g-ba.de/downloads/40-268-8513/2022-05-19_AM-RL-XII_Mepolizumab_D-747_TrG.pdf,,Krankheiten des Muskel-Skelett-Systems
"Mepolizumab (neues Anwendungsgebiet: Asthma bronchiale, ≥ 6 bis < 18 Jahre)",https://www.g-ba.de/downloads/40-268-5651/2019-03-22_AM-RL-XII_Mepolizumab_D-390_TrG.pdf,,Krankheiten des Atmungssystems
Metreleptin (Liposystrophie),https://www.g-ba.de/downloads/40-268-5641/2019-03-22_AM-RL-XII_Metreleptin_D-385_TrG.pdf,,Stoffwechselkrankheiten
Mexiletin,https://www.g-ba.de/downloads/40-268-5912/2019-08-01_AM-RL-XII_Mexiletin_D-427_TrG.pdf,https://www.g-ba.de/downloads/40-1465-5912/2019-08-01_AM-RL-XII_Mexiletin_D-427_TrG_EN.pdf,Krankheiten des Nervensystems
Midostaurin (Akute myeloische Leukämie; Systemische Mastozytose),https://www.g-ba.de/downloads/40-268-4916/2018-04-05_AM-RL-XII_Midostaurin_AML_D-319_TrG.pdf,,onkologische Erkrankungen
Migalastat (Morbus Fabry),,,Stoffwechselkrankheiten
"Migalastat (Neues Anwendungsgebiet: Morbus Fabry, 12 bis < 16 Jahre)",https://www.g-ba.de/downloads/40-268-8268/2022-02-17_AM-RL-XII_Migalastat_D-727_TrG.pdf,https://www.g-ba.de/downloads/40-1465-8268/2022-02-17_AM-RL-XII_Migalastat_D-727_TrG_EN.pdf,Stoffwechselkrankheiten
Mirabegron (Überaktive Blase),https://www.g-ba.de/downloads/40-268-3007/2014-11-20_AM-RL-XII_Mirabegron_2014-06-01-D-110_TrG.pdf,,Krankheiten des Urogenitalsystems
Misoprostol (Bekannter Wirkstoff mit neuem Unterlagenschutz: Geburtseinleitung),https://www.g-ba.de/downloads/40-268-8272/2022-02-17_AM-RL-XII_Misoprostol_D-730_TrG.pdf,https://www.g-ba.de/downloads/40-1465-8272/2022-02-17_AM-RL-XII_Misoprostol_D-730_TrG_EN.pdf,Sonstiges
Mogamulizumab (Mycosis Fungoides; Sézary Syndrom),https://www.g-ba.de/downloads/40-268-7106/2020-12-03_AM-RL-XII_Mogamulizumab_D-544_TrG.pdf,https://www.g-ba.de/downloads/40-1465-7106/2020-12-03_AM-RL_Mogamulizumab_D-544_TrG_EN.pdf,onkologische Erkrankungen
Naldemedin (Opioid-induzierte Obstipation),https://www.g-ba.de/downloads/40-268-7017/2020-11-05_AM-RL-XII_Naldemedin_D-512_TrG.pdf,https://www.g-ba.de/downloads/40-1465-7017/2020-11-05_AM-RL-XII_Naldemedin_D-512_TrG_EN.pdf,Krankheiten des Verdauungssystems
Nalmefen (Reduktion des Alkoholkonsums bei Alkoholabhängigkeit),https://www.g-ba.de/downloads/40-268-3115/2015-02-19_AM-RL-XII_Nalmefen_2014-09-01-D-127_TrG.pdf,,Psychische Erkrankungen
Natrium-Zirkonium-Cyclosilikat (Hyperkaliämie),https://www.g-ba.de/downloads/40-268-7847/2021-09-16_AM-RL-XII_Natrium-Zirconium-Cyclosilicat_D-664_TrG.pdf,https://www.g-ba.de/downloads/40-1465-7847/2021-09-16_AM-RL-XII_Natrium-Zirconium-Cyclosilicat_D-664_TrG_EN.pdf,Stoffwechselkrankheiten
Necitumumab (nicht-kleinzelliges Lungenkarzinom),https://www.g-ba.de/downloads/40-268-3974/2016-09-15_AM-RL-XII_Necitumumab_D-221_TrG.pdf,,onkologische Erkrankungen
Nepafenac (Postoperativer Schmerz nach Eingriff am Auge),https://www.g-ba.de/downloads/40-268-2603/2013-12-19_AM-RL-XII_Nepafenac_TrG.pdf,,Augenerkrankungen
"Neratinib (Mammakarzinom, HR+, HER2+, adjuvante Therapie)",https://www.g-ba.de/downloads/40-268-6566/2020-05-14_AM-RL_XII_Neratinib_D-506_TrG.pdf,https://www.g-ba.de/downloads/40-1465-6566/2020-05-14_AM-RL-XII_Neratinib_D-506_TrG_EN.pdf,onkologische Erkrankungen
Netupitant/Palonosetron (Übelkeit und Erbrechen bei Chemotherapie),https://www.g-ba.de/downloads/40-268-3577/2016-02-04_AM-RL-XII_Netupitant_Palonosetron_2015-08-15-D-172_TrG.pdf,,Sonstiges
Nintedanib (Neues Anwendungsgebiet: Chronische progredient fibrosierende interstitielle Lungenerkrankungen),https://www.g-ba.de/downloads/40-268-7287/2021-02-04_AM-RL-XII_Nintedanib-PF-ILDs_D-568_TrG.pdf,https://www.g-ba.de/downloads/40-1465-7287/2021-02-04_AM-RL-XII_Nintedanib-PF-ILD_D-568_TrG_EN.pdf,Krankheiten des Atmungssystems
Nintedanib (Neues Anwendungsgebiet: interstitielle Lungenerkrankung mit systemischer Sklerose),https://www.g-ba.de/downloads/40-268-7286/2021-02-04_AM-RL-XII_Nintedanib-SSc-ILD_D-546_TrG.pdf,https://www.g-ba.de/downloads/40-1465-7286/2021-02-04_AM-RL-XII_Nintedanib-SSC-ILD_D-546_TrG_EN.pdf,Krankheiten des Atmungssystems
Nintedanib (neues Anwendungsgebiet: idiopathische pulmonale Fibrose),https://www.g-ba.de/downloads/40-268-3339/2015-09-03_AM-RL-XII_Nintedanib_nAWG_2015-03-15-D-156_TrG.pdf,,Krankheiten des Atmungssystems
Nintedanib (nicht-kleinzelliges Lungenkarzinom),https://www.g-ba.de/downloads/40-268-3248/2015-06-18_AM-RL-XII_Nintedanib_2015-01-01-D-147_TrG.pdf,,onkologische Erkrankungen
Nintedanib (Überschreitung 50 Mio. € Grenze: Idiopathische pulmonale Fibrose),https://www.g-ba.de/downloads/40-268-6058/2019-10-17_AM-RL-XII_Nintedanib_D-450_TrG.pdf,https://www.g-ba.de/downloads/40-1465-6058/2019-10-17_AM-RL-XII_Nintdanib_D-450_TrG_EN.pdf,Krankheiten des Atmungssystems
"Niraparib (Neubewertung nach Fristablauf: Ovarialkarzinom, Eileiterkarzinom oder primäre Peritonealkarzinose)",https://www.g-ba.de/downloads/40-268-7681/2021-07-15_AM-RL-XII_Niraparib_D-643_TrG.pdf,https://www.g-ba.de/downloads/40-1465-7681/2021-07-15_AM-RL-XII_Niraparib_D-643_TrG_EN.pdf,onkologische Erkrankungen
"Niraparib (Neues Anwendungsgebiet: Ovarialkarzinom, Eileiterkarzinom oder primäres Peritonealkarzinom, FIGO-Stadien III und IV, Erhaltungstherapie)",https://www.g-ba.de/downloads/40-268-7926/2021-10-12_AM-RL-XII_Niraparib_%C3%84nderung-Therapiekosten_D-607_TrG.pdf,https://www.g-ba.de/downloads/40-1465-7544/2021-05-20_AM-RL-XII_Niraparib_D-607_TrG_EN.pdf,onkologische Erkrankungen
"Niraparib (Ovarialkarzinom, Eileiterkarzinom oder primäres Peritonealkarzinom)",https://www.g-ba.de/downloads/40-268-5050/2018-06-07_AM-RL-XII_Niraparib_D-331_TrG.pdf,,onkologische Erkrankungen
"Niraparib (Überschreitung 50 Mio. € Grenze: Ovarialkarzinom, Eileiterkarzinom oder primäres Peritonealkarzinom)",https://www.g-ba.de/downloads/40-268-6800/2020-08-20_AM-RL-XII_Niraparib_D-496_TrG.pdf,https://www.g-ba.de/downloads/40-1465-6800/2020-08-20_AM-RL-XII_Niraparib_D-496_TrG_EN.pdf,onkologische Erkrankungen
Nivolumab (Melanom),https://www.g-ba.de/downloads/40-268-4104/2016-12-15_AM-RL-XII_Nivolumab-Aufhebung%20Befristung_D-176_TrG.pdf,,onkologische Erkrankungen
"Nivolumab (Neubewertung nach Fristablauf: Melanom, BRAF-V600-WT, Erstlinie, Kombination mit Ipilimumab)",https://www.g-ba.de/downloads/40-268-5504/2018-12-20_AM-RL-XII_Nivolumab_D-370_TrG.pdf,,onkologische Erkrankungen
"Nivolumab (Neubewertung nach Fristablauf: Melanom, adjuvante Therapie)",https://www.g-ba.de/downloads/40-268-7845/2021-09-16_AM-RL-XII_Nivolumab_D-668_TrG.pdf,https://www.g-ba.de/downloads/40-1465-7845/2021-09-16_AM-RL-XII_Nivolumab_D-668_TrG_EN.pdf,onkologische Erkrankungen
"Nivolumab (Neues Anwendungsgebiet: Adenokarzinom des Magens, des gastroösophagealen Übergangs oder des Ösophagus, CPS ≥ 5, HER2-negativ, Erstlinie, Kombination mit fluoropyrimidin- und platinbasierter Kombinationschemotherapi)",https://www.g-ba.de/downloads/40-268-8518/2022-05-19_AM-RL-XII_Nivolumab_D-762_TrG.pdf,,onkologische Erkrankungen
"Nivolumab (Neues Anwendungsgebiet: Karzinom des Ösophagus oder gastroösophagealen Übergangs, vorbehandelte Patienten, adjuvante Therapie)",https://www.g-ba.de/downloads/40-268-8262/2022-02-17_AM-RL-XII_Nivolumab_D-728_TrG.pdf,https://www.g-ba.de/downloads/40-1465-8262/2022-02-17_AM-RL-XII_Nivolumab_D-728_TrG_EN.pdf,onkologische Erkrankungen
"Nivolumab (Neues Anwendungsgebiet: Kolorektalkarzinom mit Mismatch-Reparatur-Defizienz oder hoher Mikrosatelliteninstabilität, vorbehandelte Patienten, Kombination mit Ipilimumab)",https://www.g-ba.de/downloads/40-268-8179/2022-01-20_AM-RL-XII_Nivolumab_D-717_TrG.pdf,https://www.g-ba.de/downloads/40-1465-8179/2022-01-20_AM-RL-XII_Nivolumab_D-717_TrG_EN.pdf,onkologische Erkrankungen
"Nivolumab (Neues Anwendungsgebiet: Malignes Pleuramesotheliom, Erstlinie, Kombination mit Ipilimumab)",https://www.g-ba.de/downloads/40-268-8108/2021-12-16_AM-RL-XII_Nivolumab_D-707_TrG.pdf,https://www.g-ba.de/downloads/40-1465-8108/2021-12-16_AM-RL-XII_Nivolumab_D-707_TrG_EN.pdf,onkologische Erkrankungen
"Nivolumab (Neues Anwendungsgebiet: Nicht-kleinzelliges Lungenkarzinom, Kombination mit Ipilimumab und platinbasierter Chemotherapie, Erstlinie)",https://www.g-ba.de/downloads/40-268-7730/2021-07-27_AM-RL-XII_Nivolumab_D-628_TrG.pdf,https://www.g-ba.de/downloads/40-1465-7572/2021-06-03_AM-RL-XII_Nivolumab_D-628_TrG_EN.pdf,onkologische Erkrankungen
"Nivolumab (Neues Anwendungsgebiet: Nierenzellkarzinom, Erstlinienbehandlung, Kombination mit Cabozantinib)",https://www.g-ba.de/downloads/40-268-7953/2021-10-21_AM-RL-XII_Nivolumab_D-684_TrG.pdf,https://www.g-ba.de/downloads/40-1465-7953/2021-10-21_AM-RL-XII_Nivolumab_D-684_TrG_EN.pdf,onkologische Erkrankungen
"Nivolumab (Neues Anwendungsgebiet: Plattenepithelkarzinom des Ösophagus, PD-L1-Expression ≥ 1, Erstlinie, Kombination mit Ipilimumab)",,,onkologische Erkrankungen
"Nivolumab (Neues Anwendungsgebiet: Plattenepithelkarzinom des Ösophagus, PD-L1-Expression ≥ 1, Erstlinie, Kombination mit Platin- und Fluoropyrimidin-basierter Chemotherapie)",,,onkologische Erkrankungen
"Nivolumab (Neues Anwendungsgebiet: Plattenepithelkarzinom des Ösophagus, vorbehandelte Patienten)",https://www.g-ba.de/downloads/40-268-7657/2021-07-01_AM-RL-XII_Nivolumab_D-618_TrG.pdf,https://www.g-ba.de/downloads/40-1465-7657/2021-07-01_AM-RL-XII_Nivolumab_D-618_TrG_EN.pdf,onkologische Erkrankungen
"Nivolumab (Neues Anwendungsgebiet: Urothelkarzinom, PD-L1-Expression ≥ 1 %, adjuvante Therapie)",,,onkologische Erkrankungen
Nivolumab (neues Anwendungsgebiet: Hodgkin-Lymphom),https://www.g-ba.de/downloads/40-268-4426/2017-06-15_AM-RL-XII_Nivolumab_D-267_TrG.pdf,,onkologische Erkrankungen
"Nivolumab (neues Anwendungsgebiet: Melanom, Kombination mit Ipilimumab)",https://www.g-ba.de/downloads/40-268-4100/2016-12-12_AM-RL-XII_Nivolumab_nAWG_D-241_TrG.pdf,,onkologische Erkrankungen
"Nivolumab (neues Anwendungsgebiet: Melanom, adjuvante Therapie)",https://www.g-ba.de/downloads/40-268-5590/2019-02-21_AM-RL-XII_Nivolumab_D-386_TrG.pdf,,onkologische Erkrankungen
Nivolumab (neues Anwendungsgebiet: Nierenzellkarzinom),https://www.g-ba.de/downloads/40-268-4021/2016-10-20_AM-RL-XII_Nivolumab_Nierenzellkarzinom_D-230_TrG.pdf,,onkologische Erkrankungen
"Nivolumab (neues Anwendungsgebiet: Nierenzellkarzinom, Erstlinie, Kombination mit Ipilimumab)",https://www.g-ba.de/downloads/40-268-5935/2019-08-15_AM-RL-XII_Nivolumab_D-439_TrG.pdf,https://www.g-ba.de/downloads/40-1465-5935/2019-08-15_AM-RL-XII_Nivolumab_D-439_TrG_EN.pdf,onkologische Erkrankungen
Nivolumab (neues Anwendungsgebiet: Plattenepithelkarzinom Kopf-Hals-Bereich),https://www.g-ba.de/downloads/40-268-4660/2017-11-17_AM-RL-XII_Nivolumab_D-291_TrG.pdf,,onkologische Erkrankungen
Nivolumab (neues Anwendungsgebiet: Urothelkarzinom),https://www.g-ba.de/downloads/40-268-4723/2017-12-21_AM-RL-XII_Nivolumab_D-293_TrG.pdf,,onkologische Erkrankungen
"Nivolumab (neues Anwendungsgebiet: nicht-kleinzelliges Lungenkarzinom, Nicht-Plattenepithelhistologie, nach vorheriger Chemotherapie)",https://www.g-ba.de/downloads/40-268-4023/2016-10-20_AM-RL-XII_Nivolumab-nAWG-NSCLC_D-231_TrG.pdf,,onkologische Erkrankungen
"Nivolumab (neues Anwendungsgebiet: nicht-kleinzelliges Lungenkarzinom, Plattenepithelhistologie, nach vorheriger Chemotherapie)",https://www.g-ba.de/downloads/40-268-3578/2016-02-04_AM-RL-XII_Nivolumab_2015-07-15-D-184_TrG.pdf,,onkologische Erkrankungen
"Nonacog beta pegol (Hämophilie B, ≥ 12 Jahre)",https://www.g-ba.de/downloads/40-268-5091/2018-06-26_AM-RL-XII_Nonacoq_beta_pegol-Aenderung-Therapiekosten_D-322_TrG.pdf,,Krankheiten des Blutes und der blutbildenden Organe
Nusinersen (Spinale Muskelatrophie),https://www.g-ba.de/downloads/40-268-5749/2019-05-16_AM-RL-XII_Nusinersen_D-294_TrG.pdf,https://www.g-ba.de/downloads/40-1465-5749/2019-05-16_AM-RL-XII_Nusinersen_D-294_TrG_EN.pdf,Krankheiten des Nervensystems
Nusinersen (Überschreitung 50 Mio € Grenze: Spinale Muskelatrophie),https://www.g-ba.de/downloads/40-268-7541/2021-05-20_AM-RL-XII_Nusinersen_D-614_TrG.pdf,https://www.g-ba.de/downloads/40-1465-7541/2021-05-20_AM-RL-XII_Nusinersen_D-614_TrG_EN.pdf,Krankheiten des Nervensystems
Obeticholsäure,https://www.g-ba.de/downloads/40-268-4455/2017-07-06_AM-RL-XII_Obeticholsaeure_D-269_TrG.pdf,,Krankheiten des Verdauungssystems
Obinutuzumab (Chronische lymphatische Leukämie),https://www.g-ba.de/downloads/40-268-3098/2015-02-05_AM-RL-XII_Obinutuzumab_2014-08-15-D-120_TrG.pdf,,onkologische Erkrankungen
Obinutuzumab (neues Anwendungsgebiet: Follikuläres Lymphom),https://www.g-ba.de/downloads/40-268-4105/2016-12-15_AM-RL-XII_Obinutuzumab_D-229_TrG.pdf,,onkologische Erkrankungen
"Obinutuzumab (neues Anwendungsgebiet: Follikuläres Lymphom, Erstlinie)",https://www.g-ba.de/downloads/40-268-4914/2018-04-05_AM-RL-XII_Obinutuzumab_nAWG_D-305_TrG.pdf,,onkologische Erkrankungen
Obinutuzumab (Überschreitung 50 Mio. € Grenze: Chronische lymphatische Leukämie),https://www.g-ba.de/downloads/40-268-8005/2021-11-04_AM-RL-XII_Obinutuzumab_D-662_TrG.pdf,https://www.g-ba.de/downloads/40-1465-8005/2021-11-04_AM-RL-XII_Obinutuzumab_D-662_TrG_EN.pdf,onkologische Erkrankungen
Obinutuzumab (Überschreitung 50 Mio. € Grenze: Follikuläres Lymphom),https://www.g-ba.de/downloads/40-268-8003/2021-11-04_AM-RL-XII_Obinutuzumab_D-673_TrG.pdf,https://www.g-ba.de/downloads/40-1465-8003/2021-11-04_AM-RL-XII_Obinutuzumab_D-673_TrG_EN.pdf,onkologische Erkrankungen
"Obinutuzumab (Überschreitung 50 Mio. € Grenze: Follikuläres Lymphom, Erstlinie)",https://www.g-ba.de/downloads/40-268-8001/2021-11-04_AM-RL-XII_Obinutuzumab_D-674_TrG.pdf,https://www.g-ba.de/downloads/40-1465-8001/2021-11-04_AM-RL-XII_Obinutuzumab_D-674_TrG_EN.pdf,onkologische Erkrankungen
Ocrelizumab,https://www.g-ba.de/downloads/40-268-5167/2018-08-02_AM-RL-XII_Ocrelizumab_D-332_TrG.pdf,,Krankheiten des Nervensystems
Ocriplasmin,https://www.g-ba.de/downloads/40-268-2536/2013-10-17_AM-RL-XII_Ocriplasmin_TrG.pdf,,Augenerkrankungen
Ocriplasmin (Neubewertung nach Fristablauf: Vitreomakuläre Traktion),https://www.g-ba.de/downloads/40-268-5682/2019-04-04_AM-RL-XII_Ocriplasmin_D-399_TrG.pdf,,Augenerkrankungen
Odevixibat (Cholestase (≥ 6 Monate)),https://www.g-ba.de/downloads/40-268-8324/2022-03-03_AM-RL_XII_Odevixibat_D-725_TrG.pdf,https://www.g-ba.de/downloads/40-1465-8324/2022-03-03_AM-RL-XII_Odevixibat_D-725_TrG_EN.pdf,Krankheiten des Verdauungssystems
Olaparib,https://www.g-ba.de/downloads/40-268-5163/2018-08-02_AM-RL-XII_Olaparib_D-166_TrG.pdf,,onkologische Erkrankungen
"Olaparib (Neues Anwendungsgebiet: Adenokarzinom des Pankreas, BRCA1/2-Mutationen, Erhaltungstherapie)",https://www.g-ba.de/downloads/40-268-7573/2021-06-03_AM-RL-XII_Olaparib_D-581_TrG.pdf,https://www.g-ba.de/downloads/40-1465-7573/2021-06-03_AM-RL-XII_Olaparib_D-581_TrG_EN.pdf,onkologische Erkrankungen
"Olaparib (Neues Anwendungsgebiet: Ovarialkarzinom, Eileiterkarzinom oder primäres Peritonealkarzinom, FIGO-Stadien III und IV, HRD-positiv, Erhaltungstherapie, Kombination mit Bevacizumab)",https://www.g-ba.de/downloads/40-268-7568/2021-06-03_AM-RL-XII_Olaparib_D-616_TrG.pdf,https://www.g-ba.de/downloads/40-1465-7568/2021-06-03_AM-RL-XII_Olaparib_D-616_TrG_EN.pdf,onkologische Erkrankungen
"Olaparib (Neues Anwendungsgebiet: Prostatakarzinom, BRCA1/2-Mutationen, Progredienz nach hormoneller Behandlung)",https://www.g-ba.de/downloads/40-268-7732/2021-07-27_AM-RL-XII_Olaparib_D-615_TrG.pdf,https://www.g-ba.de/downloads/40-1465-7567/2021-06-03_AM-RL-XII_Olaparib_D-615_TrG_EN.pdf,onkologische Erkrankungen
"Olaparib (neues Anwendungsgebiet: Mammakarzinom, BRCA1/2-Mutationen, HER2-)",https://www.g-ba.de/downloads/40-268-6287/2020-01-16_AM-RL-XII_Olaparib_D-459-TrG.pdf,https://www.g-ba.de/downloads/40-1465-6287/2020-01-16_AM-RL-XII_Olaparib_D-459_TrG_EN.pdf,onkologische Erkrankungen
