report,justification_de_url,justification_en_url,TA
"Olaparib (neues Anwendungsgebiet: Ovarialkarzinom, Eileiterkarzinom oder primäres Peritonealkarzinom, BRCA-mutiert, FIGO-Stadien III und IV, Erhaltungstherapie)",https://www.g-ba.de/downloads/40-268-6286/2020-01-16_AM-RL-XII_Olaparib_D-464_TrG.pdf,https://www.g-ba.de/downloads/40-1465-6286/2020-01-16_AM-RL-XII_Olaparib_D-464_TrG_EN.pdf,onkologische Erkrankungen
"Olaparib (neues Anwendungsgebiet; Bewertung nach Aufhebung Orphan-Drug Status: Ovarialkarzinom, Eileiterkarzinom oder primäres Peritonealkarzinom, Platin-Sensitiv, Erhaltungstherapie)",https://www.g-ba.de/downloads/40-268-5560/2018-12-06_AM-RL-XII_Olaparib_D-360_TrG.pdf,,onkologische Erkrankungen
Olaratumab [aufgehoben] (Weichgewebesarkom),https://www.g-ba.de/downloads/40-268-6288/2020-01-16_AM-RL-XII_Olaratumab_D-265_TrG.pdf,https://www.g-ba.de/downloads/40-1465-6288/2020-01-16_AM-RL-XII_Olaratumab_D-265_TrG_EN.pdf,onkologische Erkrankungen
"Olmesartanmedoxomil, Amlodipin, Hydrochlorothiazid",,,Herz-Kreislauf-Erkrankungen
Olodaterol (COPD),https://www.g-ba.de/downloads/40-268-2889/2014-07-17_AM-RL-IX-XII_Beta2-Sympathomimetika_inhalativ_Eingr_Olodaterol_Gr1_TrG.pdf,,Krankheiten des Atmungssystems
Ombitasvir/Paritaprevir/Ritonavir (Chronische Hepatitis C),https://www.g-ba.de/downloads/40-268-3826/2016-06-16_AM-RL-XII_Ombitasvir-Paritaprevir-Ritonavir_D-153_Aenderung_TrG.pdf,,Infektionskrankheiten
Onasemnogen-Abeparvovec (Spinale Muskelatrophie),https://www.g-ba.de/downloads/40-268-7105/2020-12-03_AM-RL-XII_Aussetzung-OnasemnogenAbeparvovec_D-549_TrG.pdf,,Krankheiten des Nervensystems
Onasemnogen-Abeparvovec (Überschreitung 50 Mio € Grenze: Spinale Muskelatrophie),https://www.g-ba.de/downloads/40-268-8006/2021-11-04_AM-RL-XII_Onasemnogen-Abeparvovec_D-679_TrG.pdf,https://www.g-ba.de/downloads/40-1465-8006/2021-11-04_AM-RL-XII_Onasemnogen-Abeparvovec_D-679_TrG_EN.pdf,Krankheiten des Nervensystems
Opicapon,https://www.g-ba.de/downloads/40-268-4247/2017-03-16_AM-RL-XII_Opicapon_D-258_TrG.pdf,,Krankheiten des Nervensystems
Osilodrostat (endogenes Cushing-Syndrom),https://www.g-ba.de/downloads/40-268-7211/2021-01-07_AM-RL-XII_Osilodrostat_D-573_TrG_ausgetauscht-2021-02-23.pdf,,Stoffwechselkrankheiten
"Osimertinib (Neubewertung nach Fristablauf: nicht-kleinzelliges Lungenkarzinom, T790M-EGFR-Mutation)",https://www.g-ba.de/downloads/40-268-4602/2017-10-19_AM-RL-XII_Osimertinib_D-282_TrG.pdf,,onkologische Erkrankungen
"Osimertinib (Neues Anwendungsgebiet: Nicht-kleinzelliges Lungenkarzinom, EGFR Mutationen, adjuvante Therapie)",https://www.g-ba.de/downloads/40-268-8110/2021-12-16_AM-RL-XII_Osimertinib_D-701_TrG.pdf,https://www.g-ba.de/downloads/40-1465-8110/2021-12-16_AM-RL-XII_Osimertinib_D-701_TrG_EN.pdf,onkologische Erkrankungen
"Osimertinib (neues Anwendungsgebiet: nicht-kleinzelliges Lungenkarzinom, Erstlinie)",https://www.g-ba.de/downloads/40-268-5531/2019-01-17_AM-RL-XII_Osimertinib_D-369_TrG.pdf,,onkologische Erkrankungen
"Osimertinib (nicht-kleinzelliges Lungenkarzinom, T790M-EGFR-Mutation)",https://www.g-ba.de/downloads/40-268-4101/2016-12-15_AM-RL-XII_Osimertinib-Fristverkuerzung_D-219_TrG.pdf,,onkologische Erkrankungen
Ospemifen (Vulvovaginale Atrophie),https://www.g-ba.de/downloads/40-268-4024/2016-10-20_AM-RL-XII_Ospemifen_D-223_TrG.pdf,,Krankheiten des Urogenitalsystems
"Ozanimod (Neues Anwendungsgebiet: Colitis Ulcerosa, vorbehandelte Patienten)",,,Krankheiten des Verdauungssystems
Ozanimod (Schubförmig remittierende Multiple Sklerose),https://www.g-ba.de/downloads/40-268-7452/2021-04-15_AM-RL-XII_Ozanimod_D-567_TrG.pdf,https://www.g-ba.de/downloads/40-1465-7210/2021-01-07_AM-RL-XII_Ozanimod_D-567_TrG_EN.pdf,Krankheiten des Nervensystems
Palbociclib (Mammakarzinom),https://www.g-ba.de/downloads/40-268-6936/2020-10-15_AM-RL-XII_Palbociclib_D-264_TrG.pdf,https://www.g-ba.de/downloads/40-1465-4388/2017-05-18_AM-RL-XII_Palbociclib_D-264_TrG_EN.pdf,onkologische Erkrankungen
"Palbociclib (Neubewertung nach Fristablauf: Mammakarzinom, Patientenpopulation b1) und b2))",https://www.g-ba.de/downloads/40-268-5889/2019-07-18_AM-RL-XII_Palbociclib_D-395_TrG.pdf,,onkologische Erkrankungen
"Panobinostat (Multiples Myelom, mind. 2 Vortherapien, Kombination mit Bortezomib und Dexamethason)",https://www.g-ba.de/downloads/40-268-3666/2016-03-17_AM-RL-XII_Panobinostat_D-180_TrG.pdf,,onkologische Erkrankungen
Parathyroidhormon (Osteoporose),https://www.g-ba.de/downloads/40-268-2779/2014-03-17_35a_EinstellungBestandsmarkt_TrG.pdf,,Krankheiten des Muskel-Skelett-Systems
Pasireotid (Hypophysendysfunktion),https://www.g-ba.de/downloads/40-268-2145/2012-12-06_AM-RL-XII_Pasireotid_TrG.pdf,,Stoffwechselkrankheiten
Pasireotid (neues Anwendungsgebiet: Akromegalie),https://www.g-ba.de/downloads/40-268-3250/2015-06-18_AM-RL-XII_Pasireotid_nAWG_2015-01-01-D-148_TrG.pdf,,Stoffwechselkrankheiten
Patiromer (Hyperkaliämie),https://www.g-ba.de/downloads/40-268-5236/2018-09-20_AM-RL-XII_Patiromer_D-351_TrG.pdf,,Stoffwechselkrankheiten
Patisiran (Amyloidose),https://www.g-ba.de/downloads/40-268-5647/2019-03-22_AM-RL-XII_Patisiran_D-391_TrG.pdf,,Stoffwechselkrankheiten
"Pegcetacoplan (Paroxysmale Nächtliche Hämoglobinurie, vorbehandelte Patienten)",,,Krankheiten des Blutes und der blutbildenden Organe
Pegvaliase (Phenylketonurie),https://www.g-ba.de/downloads/40-268-6235/2019-12-19_AM-RL-XII_Pegvaliase_D-467_TrG.pdf,https://www.g-ba.de/downloads/40-1465-6235/2019-12-19_AM-RL-XII_Pegvaliase_D-467_TrG_EN.pdf,Stoffwechselkrankheiten
"Pembrolizumab (Erneute Nutzenbewertung § 13: Urothelkarzinom, CPS ≥ 10, Erstlinie)",https://www.g-ba.de/downloads/40-268-6401/2020-03-05_AM-RL-XII_Pembrolizumab_D-424_TrG.pdf,https://www.g-ba.de/downloads/40-1465-6401/2020-03-05_AM-RL_XII_Pembrolizumab_D-424_TrG_EN.pdf,onkologische Erkrankungen
Pembrolizumab (Melanom),https://www.g-ba.de/downloads/40-268-3592/2016-02-04_AM-RL-XII_Pembrolizumab_2015-08-15-D-186_TrG.pdf,,onkologische Erkrankungen
"Pembrolizumab (Neubewertung nach Fristablauf: Urothelkarzinom, CPS ≥ 10, Erstlinie)",https://www.g-ba.de/downloads/40-268-7844/2021-09-16_AM-RL-XII_Pembrolizumab_D-661_TrG.pdf,https://www.g-ba.de/downloads/40-1465-7844/2021-09-16_AM-RL-XII_Pembrolizumab_D-661_TrG_EN.pdf,onkologische Erkrankungen
"Pembrolizumab (Neues Anwendungsgebiet: Endometriumkarzinom, nach Platin-basierter Therapie, Kombination mit Lenvatinib)",,,onkologische Erkrankungen
"Pembrolizumab (Neues Anwendungsgebiet: Hodgkin-Lymphom, vorbehandelte Patienten, ≥ 3 Jahre)",https://www.g-ba.de/downloads/40-268-8094/2021-12-07_AM-RL-XII_Pembrolizumab_Aenderung_Therapiekosten_D-652_TrG.pdf,https://www.g-ba.de/downloads/40-1465-7842/2021-09-16_AM-RL-XII_Pembrolizumab_D-652_TrG_EN.pdf,onkologische Erkrankungen
"Pembrolizumab (Neues Anwendungsgebiet: Karzinom des Ösophagus oder gastroösophagealen Übergangs, PD-L1-Expression ≥ 10 (CPS), Erstlinie, Kombination mit Platin- und Fluoropyrimidin-basierter Chemotherapie)",https://www.g-ba.de/downloads/40-268-8493/2022-05-05_AM-RL-XII_Pembrolizumab_D-751-TrG.pdf,https://www.g-ba.de/downloads/40-1465-8493/2022-05-05_AM-RL-XII_Pembrolizumab_D-751_TrG_EN.pdf,onkologische Erkrankungen
"Pembrolizumab (Neues Anwendungsgebiet: Kolorektalkarzinom mit MSI-H oder dMMR, Erstlinie)",https://www.g-ba.de/downloads/40-268-7843/2021-09-16_AM-RL-XII_Pembrolizumab_D-653_TrG.pdf,https://www.g-ba.de/downloads/40-1465-7843/2021-09-16_AM-RL-XII_Pembrolizumab_D-653_TrG_EN.pdf,onkologische Erkrankungen
"Pembrolizumab (Neues Anwendungsgebiet: Mammakarzinom, triple-negativ, PD-L1-Expression ≥ 10 (CPS), Kombination mit Chemotherapie)",https://www.g-ba.de/downloads/40-268-8492/2022-05-05_AM-RL-XII_Pembrolizumab_D-752_TrG.pdf,https://www.g-ba.de/downloads/40-1465-8492/2022-05-05_AM-RL-XII_Pembrolizumab_D-752_TrG_EN.pdf,onkologische Erkrankungen
"Pembrolizumab (Neues Anwendungsgebiet: fortgeschrittenes Nierenzellkarzinom, Erstlinie, Kombination mit Lenvatinib)",,,onkologische Erkrankungen
Pembrolizumab (neues Anwendungsgebiet: Hodgkin-Lymphom),https://www.g-ba.de/downloads/40-268-4659/2017-11-17_AM-RL-XII_Pembrolizumab_D-288_TrG.pdf,,onkologische Erkrankungen
"Pembrolizumab (neues Anwendungsgebiet: Melanom, adjuvante Therapie)",https://www.g-ba.de/downloads/40-268-6013/2019-09-19_AM-RL-XII_Pembrolizumab_nAWG_D-446_TrG.pdf,https://www.g-ba.de/downloads/40-1465-6013/2019-09-19_AM-RL-XII_Pembrolizumab_D-446_TrG_EN.pdf,onkologische Erkrankungen
"Pembrolizumab (neues Anwendungsgebiet: Nierenzellkarzinom, Erstlinie, Kombination mit Axitinib)",https://www.g-ba.de/downloads/40-268-6565/2020-05-14_AM-RL-XII_Pembrolizumab-RCC_D-502_TrG.pdf,https://www.g-ba.de/downloads/40-1465-6565/2020-05-14_AM-RL-XII_Pembrolizumab-RCC_D-502_TrG_EN.pdf,onkologische Erkrankungen
Pembrolizumab (neues Anwendungsgebiet: Plattenepithelkarzinom Kopf-Hals-Bereich),https://www.g-ba.de/downloads/40-268-5936/2019-08-15_AM-RL-XII_Pembrolizumab_D-396_TrG.pdf,,onkologische Erkrankungen
"Pembrolizumab (neues Anwendungsgebiet: Plattenepithelkarzinom Kopf-Hals-Bereich, PD-L1-Expression  ≥ 1%, Erstlinie, Kombination mit Platin- und 5-Fluorouracil (5-FU)-Chemotherapie)",https://www.g-ba.de/downloads/40-268-6562/2020-05-14_AM-RL-XII_Pembrolizumab_D-508_TrG.pdf,https://www.g-ba.de/downloads/40-1465-6562/2020-05-14_AM-RL-XII_Pembrolizumab_D-508_TrG_EN.pdf,onkologische Erkrankungen
"Pembrolizumab (neues Anwendungsgebiet: Plattenepithelkarzinom Kopf-Hals-Bereich, PD-L1-Expression  ≥ 1%, Erstlinie, Monotherapie)",https://www.g-ba.de/downloads/40-268-6560/2020-05-14_AM-RL-XII_Pembrolizumab_D-501_TrG.pdf,https://www.g-ba.de/downloads/40-1465-6560/2020-05-14_AM-RL-XII_Pembrolizumab_D-501_TrG_EN.pdf,onkologische Erkrankungen
Pembrolizumab (neues Anwendungsgebiet: Urothelkarzinom),https://www.g-ba.de/downloads/40-268-5171/2018-08-02_AM-RL-XII_Pembrolizumab_D-311_TrG.pdf,,onkologische Erkrankungen
"Pembrolizumab (neues Anwendungsgebiet: nicht-kleinzelliges Lungenkarzinom, Erstlinie)",https://www.g-ba.de/downloads/40-268-4514/2017-08-03_AM-RL-XII_Pembrolizumab_D274_TrG.pdf,,onkologische Erkrankungen
"Pembrolizumab (neues Anwendungsgebiet: nicht-kleinzelliges Lungenkarzinom, Nicht-Plattenepithelhistologie, Erstlinie, Kombination mit Pemetrexed und Platin-Chemotherapie)",https://www.g-ba.de/downloads/40-268-6313/2020-01-28_AM-RL-XII_Pembrolizumab_D-447_TrG.pdf,https://www.g-ba.de/downloads/40-1465-6021/2019-09-19_AM-RL-XII_Pembrolizumab_D-447_TrG_EN.pdf,onkologische Erkrankungen
"Pembrolizumab (neues Anwendungsgebiet: nicht-kleinzelliges Lungenkarzinom, Plattenepithelhistologie, Erstlinie, Kombination mit Carboplatin und (nab-) Paclitaxel)",https://www.g-ba.de/downloads/40-268-6011/2019-09-19_AM-RL-XII_Pembrolizumab_D-448_nAWG_TrG.pdf,https://www.g-ba.de/downloads/40-1465-6011/2019-09-19_AM-RL-XII_Pembrolizumab_D-448_TrG_EN.pdf,onkologische Erkrankungen
"Pembrolizumab (neues Anwendungsgebiet: nicht-kleinzelliges Lungenkarzinom, nach vorheriger Chemotherapie)",https://www.g-ba.de/downloads/40-268-4190/2017-02-02_AM-RL-XII_Pembrolizumab_D-251_TrG.pdf,,onkologische Erkrankungen
"Pemigatinib (Cholangiokarzinom mit FGFR2-Fusion oder FGFR2-Rearrangement, nach mind. 1 Vortherapie)",https://www.g-ba.de/downloads/40-268-7906/2021-10-07_AM-RL-XII_Pemigatinib_D-670_TrG.pdf,https://www.g-ba.de/downloads/40-1465-7906/2021-10-07_AM-RL-XII_Pemigatinib_D-670_TrG_EN.pdf,onkologische Erkrankungen
Perampanel,https://www.g-ba.de/downloads/40-268-2673/2014-02-06_AM-RL-XII_Perampanel-erneuteNB_TrG.pdf,,Krankheiten des Nervensystems
"Perampanel (Erneute Nutzenbewertung: Epilepsie, fokale Anfälle, ≥ 12 Jahre)",https://www.g-ba.de/downloads/40-268-2997/2014-11-06_AM-RL-XII_Perampanel_2014-05-15-D-106_TrG.pdf,,Krankheiten des Nervensystems
"Perampanel (Neues Anwendungsgebiet: Epilepsie, fokale Anfälle, 4 bis < 12 Jahre)",https://www.g-ba.de/downloads/40-268-7574/2021-06-03_AM-RL-XII_Perampanel_D-604_TrG.pdf,https://www.g-ba.de/downloads/40-1465-7574/2021-06-03_AM-RL-XII_Perampanel_D-604_TrG_EN.pdf,Krankheiten des Nervensystems
"Perampanel (Neues Anwendungsgebiet: Epilepsie, prim. generalisierte Anfälle, 7 bis < 12 Jahre)",https://www.g-ba.de/downloads/40-268-7575/2021-06-03_AM-RL-XII_Perampanel_D-634_TrG.pdf,https://www.g-ba.de/downloads/40-1465-7575/2021-06-03_AM-RL-XII_Perampanel_D-634_TrG_EN.pdf,Krankheiten des Nervensystems
"Perampanel (neues Anwendungsgebiet: Epilepsie, prim. generalisierte Anfälle, ≥ 12 Jahre)",https://www.g-ba.de/downloads/40-268-4984/2018-05-17_AM-RL-XII_Perampanel_D-325_TrG.pdf,,Krankheiten des Nervensystems
"Pertuzumab (Mammakarzinom, HER2+, Kombination mit Trastuzumab und Docetaxel)",https://www.g-ba.de/downloads/40-268-3762/2016-05-19_AM-RL-XII_Pertuzumab_2013-04-01-D-057-Aufh-Befrist_TrG.pdf,,onkologische Erkrankungen
"Pertuzumab (neues Anwendungsgebiet: Mammakarzinom, entzündlich oder früh mit hohem Rezidivrisiko, Neoadjuvanz, Kombination mit Trastuzumab und Chemotherapie)",https://www.g-ba.de/downloads/40-268-3610/2016-02-18_AM-TL-XII_Pertuzumab-nAWG_2015-09-01-D-177_TrG.pdf,,onkologische Erkrankungen
"Pertuzumab (neues Anwendungsgebiet: Mammakarzinom, früh mit hohem Rezidivrisiko, Adjuvanz, Kombination mit Trastuzumab und Chemotherapie)",https://www.g-ba.de/downloads/40-268-7238/2021-01-21_AM-RL-XII_Pertuzumab_D-363_TrG.pdf,https://www.g-ba.de/downloads/40-1465-5503/2018-12-20_AM-RL-XII_Pertuzumab_D-363_TrG_EN.pdf,onkologische Erkrankungen
"Pertuzumab/Trastuzumab (Mammakarzinom, HER2+, früh mit hohem Rezidivrisiko, adjuvante Therapie, Kombination mit Chemotherapie)",https://www.g-ba.de/downloads/40-268-7680/2021-07-15_AM-RL-XII_Pertuzumab-Trastuzumab_D-632_TrG.pdf,https://www.g-ba.de/downloads/40-1465-7680/2021-07-15_AM-RL-XII_Pertuzumab-Trastuzumab_D-632_TrG_EN.pdf,onkologische Erkrankungen
"Pertuzumab/Trastuzumab (Mammakarzinom, HER2+, lokal fortgeschritten oder entzündlichem oder früh mit hohem Rezidivrisiko, neoadjuvante Therapie, Kombination mit Chemotherapie)",https://www.g-ba.de/downloads/40-268-7682/2021-07-15_AM-RL-XII_Pertuzumab-Trastuzumab_D-631_TrG.pdf,https://www.g-ba.de/downloads/40-1465-7682/2021-07-15_AM-RL-XII_Pertuzumab-Trastuzumab_D-631_TrG_EN.pdf,onkologische Erkrankungen
"Pertuzumab/Trastuzumab (Mammakarzinom, HER2+, metastasiert oder lokal rezidiviert (inoperabel), Erstlinie, Kombination mit Docetaxel)",https://www.g-ba.de/downloads/40-268-7683/2021-07-15_AM-RL-XII_Pertuzumab-Trastuzumab_D-630_TrG.pdf,https://www.g-ba.de/downloads/40-1465-7683/2021-07-15_AM-RL-XII_Pertuzumab-Trastuzumab_D-630_TrG_EN.pdf,onkologische Erkrankungen
Pirfenidon (Idiopathische pulmonale Fibrose),https://www.g-ba.de/downloads/40-268-1904/2012-03-15_AM-RL-XII_Pirfenidon_TrG.pdf,,Krankheiten des Atmungssystems
"Pitavastatin (Primäre Hypercholesterinämie, gemischte Dyslipidämie)",https://www.g-ba.de/downloads/40-268-1730/2011-08-18_35a_HMG-CoA-Reduktasehemmer_TrG.pdf,,Stoffwechselkrankheiten
Pitolisant,https://www.g-ba.de/downloads/40-268-4159/2017-01-19_AM-RL-XII_Pitolisant_D-250_TrG.pdf,,Krankheiten des Nervensystems
"Pitolisant (Tagesschläfrigkeit bei obstruktiver Schlafapnoe, nach Vortherapie)",https://www.g-ba.de/downloads/40-268-8441/2022-04-21_AM-RL-XII_Pitolisant_D-740_TrG.pdf,https://www.g-ba.de/downloads/40-1465-8441/2022-04-21_AM-RL-XII_Pitolisant_D-740_TrG_EN.pdf,Krankheiten des Nervensystems
Pixantron (B-Zell-Non-Hodgkin-Lymphom),https://www.g-ba.de/downloads/40-268-2314/2013-05-16_AM-RL-XII_Pixantron_TrG.pdf,,onkologische Erkrankungen
"Polatuzumab Vedotin (Diffus großzelliges B-Zell-Lymphom, Kombination mit Bendamustin und Rituximab)",https://www.g-ba.de/downloads/40-268-6796/2020-08-20_AM-RL-XII_Polatuzumab-Vedotin_D-507_TrG.pdf,https://www.g-ba.de/downloads/40-1465-6796/2020-08-20_AM-RL-XII_Polatuzumab-Vedotin_D-507_TrG_EN.pdf,onkologische Erkrankungen
"Polatuzumab Vedotin (Neues Anwendungsgebiet: Diffus großzelliges B-Zell-Lymphom, Kombination mit Rituximab, Cyclophosphamid, Doxorubicin und Prednison (R-CHP))",,,onkologische Erkrankungen
Pomalidomid,https://www.g-ba.de/downloads/40-268-2693/2014-02-20_AM-RL-XII_Pomalidomid_2013-09-01-D-075_TrG.pdf,,onkologische Erkrankungen
"Pomalidomid (neues Anwendungsgebiet: Multiples Myelom, mind. 1 Vortherapie, Kombination mit Bortezomib und Dexamethason)",https://www.g-ba.de/downloads/40-268-6198/2019-12-05_AM-RL-XII_Pomalidomid_D-456_TrG.pdf,https://www.g-ba.de/downloads/40-1465-6198/2019-12-05_AM-RL-XII_Pomalidomid_D-456_TrG_EN.pdf,onkologische Erkrankungen
"Pomalidomid (Überschreitung 50 Mio € Grenze: Multiples Myelom, mind. 2 Vortherapien, Kombination mit Dexamethason)",https://www.g-ba.de/downloads/40-268-3670/2016-03-17_AM-RL-XII_Pomalidomid_D-193_TrG.pdf,,onkologische Erkrankungen
"Ponatinib (Chronische myeloische Leukämie;  Akute lymphatische Leukämie, Ph+ oder T315I-Mutation)",https://www.g-ba.de/downloads/40-268-6062/2019-10-17_AM-RL-XII_Ponatinib_D-071_Aenderung-Geltungsdauer_TrG.pdf,https://www.g-ba.de/downloads/40-1465-2646/2014-01-23_AM-RL-XII_Ponatinib_D-071_TrG_EN.pdf,onkologische Erkrankungen
Ponatinib (Neubewertung nach Fristablauf: Akute lymphatische Leukämie),https://www.g-ba.de/downloads/40-268-7055/2020-11-20_AM-RL-XII_Ponatinib_D-554_TrG.pdf,https://www.g-ba.de/downloads/40-1465-7055/2020-11-20_AM-RL-XII_Ponatinib_D-554_TrG_EN.pdf,onkologische Erkrankungen
Ponatinib (Neubewertung nach Fristablauf: Chronische myeloische Leukämie),https://www.g-ba.de/downloads/40-268-7054/2020-11-20_AM-RL-XII_Ponatinib_D-550_TrG.pdf,https://www.g-ba.de/downloads/40-1465-7054/2020-11-20_AM-RL-XII_Ponatinib_D-550_TrG_EN.pdf,onkologische Erkrankungen
Ponesimod (Schubförmige Multiple Sklerose),https://www.g-ba.de/downloads/40-268-8078/2021-12-02_AM-RL-XII_Ponesimod-Pat-a_D-702_TrG.pdf,https://www.g-ba.de/downloads/40-1465-8079/2021-12-02_AM-RL-XII_Ponesimod_D-702_Pat-b_TrG_EN.pdf,Krankheiten des Nervensystems
"Pralsetinib (Lungenkarzinom, nicht-kleinzelliges, RET-Fusion+)",,,onkologische Erkrankungen
Prasteron (vulvovaginale Atrophie),https://www.g-ba.de/downloads/40-268-6056/2019-10-17_AM-RL-XII_Prasteron_D-458_TrG.pdf,https://www.g-ba.de/downloads/40-1465-6056/2019-10-17_AM-RL-XII_Prasteron_D-458_TrG_EN.pdf,Krankheiten des Urogenitalsystems
Propranolol (Infantiles Hämangiom),https://www.g-ba.de/downloads/40-268-3117/2015-02-19_AM-RL-XII_Propranolol_2014-09-01-D-128_TrG.pdf,,Sonstiges
Radium-223-dichlorid,https://www.g-ba.de/downloads/40-268-5383/2018-11-01_AM-RL-XII_Radium-223-dichlorid_Aenderung_D-094_TrG.pdf,,onkologische Erkrankungen
Radium-223-dichlorid (Erneute Nutzenbewertung § 13: Prostatakarzinom),https://www.g-ba.de/downloads/40-268-6059/2019-10-17_AM-RL-XII_Radium-223-dichlorid_D-455_TrG.pdf,https://www.g-ba.de/downloads/40-1465-6059/2019-10-17_AM-RL-XII_Radium-223-dichlorid_D-455_TrG_EN.pdf,onkologische Erkrankungen
Ramucirumab,https://www.g-ba.de/downloads/40-268-3275/2015-07-16_AM-RL-XII_Ramucirumab_2015-02-01-D-150_TrG.pdf,,onkologische Erkrankungen
Ramucirumab (Bewertung nach Aufhebung des Orphan Drug-Status: Adenokarzinom des Magens oder des gastroösophagealen Übergangs;  Kombination mit Paclitaxel),https://www.g-ba.de/downloads/40-268-4022/2016-10-20_AM-RL-XII_Ramucirumab_Magenkarzinom_D-224_TrG.pdf,,onkologische Erkrankungen
Ramucirumab (neues Anwendungsgebiet: Hepatozelluläres Karzinom),https://www.g-ba.de/downloads/40-268-6359/2020-02-20_AM-RL-XII_Ramucirumab_D-474_TrG.pdf,https://www.g-ba.de/downloads/40-1465-6359/2020-02-20_AM-RL-XII_Ramucirumab_D-474_TrG_EN.pdf,onkologische Erkrankungen
Ramucirumab (neues Anwendungsgebiet: Kolorektalkarzinom),https://www.g-ba.de/downloads/40-268-3954/2016-09-01_AM-RL-XII_Ramucirumab_D-216_TrG.pdf,,onkologische Erkrankungen
Ramucirumab (neues Anwendungsgebiet: nicht-kleinzelliges Lungenkarzinom),https://www.g-ba.de/downloads/40-268-3957/2016-09-01_AM-RL-XII_Ramucirumab_nAWG_TrG.pdf,,onkologische Erkrankungen
"Ramucirumab (neues Anwendungsgebiet: nicht-kleinzelliges Lungenkarzinom, EGFR-Mutation, Erstlinie)",https://www.g-ba.de/downloads/40-268-6787/2020-08-20_AM-RL-XII_Ramucirumab_D-515_TrG.pdf,https://www.g-ba.de/downloads/40-1465-6787/2020-08-20_AM-RL-XII_Ramucirumab_D-515_TrG_EN.pdf,onkologische Erkrankungen
"Ravulizumab (Neues Anwendungsgebiet: Paroxysmale Hämoglobinurie, pädiatrische Patienten)",https://www.g-ba.de/downloads/40-268-8360/2022-03-18_AM-RL-XII_Ravulizumab_D-720_TrG.pdf,https://www.g-ba.de/downloads/40-1465-8360/2022-03-18_AM-RL-XII_Ravulizumab_D-720_TrG_EN.pdf,Krankheiten des Blutes und der blutbildenden Organe
Ravulizumab (Paroxysmale Hämoglobinurie),https://www.g-ba.de/downloads/40-268-6320/2020-02-06_AM-RL-XII_Ravulizumab_D-463_TrG.pdf,https://www.g-ba.de/downloads/40-1465-6320/2020-02-06_AM-RL-XII_Ravulizumab_D-463_TrG_EN.pdf,Krankheiten des Blutes und der blutbildenden Organe
Ravulizumab (neues Anwendungsgebiet: Atypisches Hämolytisch-Urämischen Syndrom (aHUS)),https://www.g-ba.de/downloads/40-268-7236/2021-01-21_AM-RL-XII_Ravulizumab_D-557_TrG.pdf,https://www.g-ba.de/downloads/40-1465-7236/2021-01-21_AM-RL-XII_Ravulizumab_D-557_TrG_EN.pdf,Krankheiten des Blutes und der blutbildenden Organe
Regadenoson (Myokardperfusionsaufnahmen),https://www.g-ba.de/downloads/40-268-1916/2012-03-29_AM-RL-XII_Regadenoson_TrG.pdf,,Sonstiges
Regadenoson (neues Anwendungsgebiet: Messung der fraktionellen Flussreserve der Stenose),https://www.g-ba.de/downloads/40-268-5931/2019-08-15_AM-RL-XII_Regadenoson_D-443_TrG.pdf,https://www.g-ba.de/downloads/40-1465-5931/2019-08-15_AM-RL-XII_Regadenoson_D-443_TrG_EN.pdf,Sonstiges
Regorafenib,https://www.g-ba.de/downloads/40-268-2750/2014-03-20_AM-RL-XII_Regorafenib_2013-10-01-D-077_TrG.pdf,,onkologische Erkrankungen
Regorafenib (Neubewertung nach Fristablauf: Kolorektalkarzinom),https://www.g-ba.de/downloads/40-268-3667/2016-03-17_AM-RL-XII_Regorafenib_2015-10-01-D-189_TrG.pdf,,onkologische Erkrankungen
Regorafenib (neues Anwendungsgebiet: Gastrointestinale Stromatumore),https://www.g-ba.de/downloads/40-268-3119/2015-02-19_AM-RL-XII_Regorafenib-nAWG_2014-09-01-D-134_TrG.pdf,,onkologische Erkrankungen
Relugolix/Estradiol/Norethisteronacetat (Uterusmyom),https://www.g-ba.de/downloads/40-268-8552/2022-05-24_AM-RL-XII_Relugolix-Estradiol_Norethisteronacetat-D-721_TrG.pdf,https://www.g-ba.de/downloads/40-1465-8263/2022-02-17_AM-RL-XII_Relugolix-E2-NETA_D-721_TrG_EN.pdf,Krankheiten des Urogenitalsystems
"Remdesivir (COVID-19, ≥ 12 Jahre, Erfordernis zusätzlicher Sauerstoffzufuhr)",https://www.g-ba.de/downloads/40-268-7846/2021-09-16_AM-RL-XII_Remdesivir_D-665_TrG.pdf,https://www.g-ba.de/downloads/40-1465-7846/2021-09-16_AM-RL-XII_Remdesivir_D-665_TrG_EN.pdf,Infektionskrankheiten
"Remdesivir (Neues Anwendungsgebiet: COVID-19, kein Erfordernis zusätzlicher Sauerstoffzufuhr, erhöhtes Risiko für schweren Verlauf)",,,Infektionskrankheiten
Reslizumab (Asthma bronchiale),https://www.g-ba.de/downloads/40-268-5459/2018-12-06_AM-RL-XII_Reslizumab_D-271_TrG.pdf,,Krankheiten des Atmungssystems
Retigabin,https://www.g-ba.de/downloads/40-268-1930/2012-05-03_AM-RL-XII_Retigabin_TrG.pdf,,Krankheiten des Nervensystems
Retigabin (Epilepsie),https://www.g-ba.de/downloads/40-268-2463/2013-08-15_AM-RL-35a_Einstellung-Retigabin_TrG.pdf,,Krankheiten des Nervensystems
"Retigabin (Erneute Nutzenbewertung: Epilepsie, fokale Anfälle)",https://www.g-ba.de/downloads/40-268-2870/2014-07-03_AM-RL-XII_Retigabin_2014-01-15-D-098_TrG.pdf,,Krankheiten des Nervensystems
"Ribociclib (Mammakarzinom, HR+, HER2-, postmenopausale Frauen, Kombination mit Aromatasehemmer)",https://www.g-ba.de/downloads/40-268-5592/2019-02-21_AM-RL-XII_Ribociclib_D-307_TrG.pdf,,onkologische Erkrankungen
"Ribociclib (Neubewertung nach Fristablauf: Mammakarzinom, HR+, HER2-, Kombination mit Fulvestrant)",https://www.g-ba.de/downloads/40-268-6812/2020-08-20_AM-RL-XII_Ribociclib_D-518-TrG.pdf,https://www.g-ba.de/downloads/40-1465-6812/2020-08-20_AM-RL-XII_Ribociclib_D-518_TrG_EN.pdf,onkologische Erkrankungen
"Ribociclib (Neubewertung nach Fristablauf: Mammakarzinom, HR+, HER2-, Kombination mit einem Aromatasehemmer)",https://www.g-ba.de/downloads/40-268-6791/2020-08-20_AM-RL-XII_Ribociclib_D-517_TrG.pdf,https://www.g-ba.de/downloads/40-1465-6791/2020-08-20_AM-RL-XII_Ribociclib_D-517_TrG_EN.pdf,onkologische Erkrankungen
"Ribociclib (neues Anwendungsgebiet: Mammakarzinom, HR+, HER2-, post-, prä- und perimenopausale Frauen, Kombination mit Fulvestrant, Kombination mit Aromatasehemmer)",https://www.g-ba.de/downloads/40-268-5883/2019-07-04_AM-RL-XII_Ribociclib-Aromatasehemmer_D-430_TrG.pdf,https://www.g-ba.de/downloads/40-1465-5883/2019-07-04_AM-RL-XII_Ribociclib-Aromatase-Inhibitor_nAWG_D-430_TrG_EN.pdf,onkologische Erkrankungen
"Rilpivirin (HIV-1-Infektion, therapieerfahrene Patienten, Kombination mit  Cabotegravir)",https://www.g-ba.de/downloads/40-268-7954/2021-10-21_AM-RL-XII_Rilpivirin_D-680_TrG.pdf,https://www.g-ba.de/downloads/40-1465-7954/2021-10-21_AM-RL-XII_Rilpivirin_D-680_TrG_EN.pdf,Infektionskrankheiten
Rilpivirin (HIV-Infektion),https://www.g-ba.de/downloads/40-268-1979/2012-07-05_AM-RL-XII_Rilpivirin_TrG.pdf,,Infektionskrankheiten
"Rilpivirin (neues Anwendungsgebiet: HIV-Infektion, 12 bis < 18 Jahre)",https://www.g-ba.de/downloads/40-268-3825/2016-06-16_AM-RL-XII_Rilpivirin_nAWG_D-209_TrG.pdf,,Infektionskrankheiten
Riociguat (Chronisch thromboembolische pulmonale Hypertonie (Überschreitung 50 Mio € Grenze)),https://www.g-ba.de/downloads/40-268-6830/2020-09-03_AM-RL-XII_Riociguat_D-527_TrG.pdf,https://www.g-ba.de/downloads/40-1465-6830/2020-09-03_AM-RL-XII_Riociguat_D-527_CTEPH_TrG_EN.pdf,Herz-Kreislauf-Erkrankungen
Riociguat (Pulmonal arterielle Hypertonie (Überschreiten 50 Mio € Grenze)),https://www.g-ba.de/downloads/40-268-6829/2020-09-03_AM-RL-XII_Riociguat_D-528_TrG.pdf,https://www.g-ba.de/downloads/40-1465-6829/2020-09-03_AM-RL-XII_Riociguat_D-528_PAH_TrG_EN.pdf,Herz-Kreislauf-Erkrankungen
